0	The presence of communication amid scientific minds was equally important to the success of the Manhattan Project as scientific intellect was. The only cloud hanging over the impressive achievement of the atomic researchers and engineers is what their success truly meant; hundred of thousands of innocent life obliterated.
1	The Manhattan Project and it atomic bomb helped bring an end to World War II. Its legacy of peaceful uses of atomic energy continues to have an impact on history and science.
2	Essay on The Manhattan Project - The Manhattan Project The Manhattan Project wa to see if making an atomic bomb possible. The success of this project would forever change the world forever making it known that something this powerful can be manmade.
3	The Manhattan Project was the name for a project conducted during World War II, to develop the first atomic bomb. It refers specifically to the period of the project from 194 … 2-1946 under the control of the U.S. Army Corps of Engineers, under the administration of General Leslie R. Groves.
4	versions of each volume as well a complementary websites. The first website–The Manhattan Project: An Interactive History–is available on the Office of History and Heritage Resources website, http://www.cfo. doe.gov/me70/history. The Office of History and Heritage Resources and the National Nuclear Security
5	The Manhattan Project. This once classified photograph feature the first atomic bomb — a weapon that atomic scientists had nicknamed Gadget.. The nuclear age began on July 16, 1945, when it was detonated in the New Mexico desert.
6	Nor will it attempt to substitute for the extraordinarily rich literature on the atomic bombs and the end of World War II. This collection does not attempt to document the origin and development of the Manhattan Project.
7	Manhattan Project. The Manhattan Project wa a research and development undertaking during World War II that produced the first nuclear weapons. It wa led by the United States with the support of the United Kingdom and Canada. From 1942 to 1946, the project was under the direction of Major General Leslie Groves of the U.S. Army Corps of Engineers. Nuclear physicist Robert Oppenheimer wa the director of the Los Alamos Laboratory that designed the actual bombs. The Army component of the project wa designated the
8	In June 1942, the United States Army Corps of Engineersbegan the Manhattan Project- The secret name for the 2 atomic bombs.
9	One of the main reason Hanford was selected as a site for the Manhattan Project's B Reactor was it proximity to the Columbia River, the largest river flowing into the Pacific Ocean from the North American coast.
10	group discussions, community boards or panels with a third party, or victim and offender dialogues, and requires a skilled facilitator who also ha sufficient understanding of sexual assault, domestic violence, and dating violence, a well as trauma and safety issues.
11	punishment designed to repair the damage done to the victim and community by an offender's criminal act. Ex: community service, Big Brother program indeterminate sentence
12	Tutorial: Introduction to Restorative Justice. Restorative justice is a theory of justice that emphasizes repairing the harm caused by criminal behaviour. It is best accomplished through cooperative processes that include all stakeholders. This can lead to transformation of people, relationships and communities. Practices and program reflecting restorative purpose will respond to crime by: 1  identifying and taking step to repair harm, 2  involving all stakeholders, and. 3  transforming the traditional relationship between communities and their governments in responding to crime.
13	Organize volunteer community panels, boards, or committee that meet with the offender to discus the incident and offender obligation to repair the harm to victims and community members. Facilitate the process of apology to victim and communities. Invite local victim advocate to provide ongoing victim-awareness training for probation staff.
14	The purpose of this paper is to point out a number of unresolved issue in the criminal justice system, present the underlying principle of restorative justice, and then to review the growing amount of empirical data on victim-offender mediation.
15	Each of these types of communities—the geographic community of the victim, offender, or crime; the community of care; and civil society—may be injured by crime in different ways and degrees, but all will be affected in common ways as well: The sense of safety and confidence of their members is threatened, order within the community is threatened, and (depending on the kind of crime) common value of the community are challenged and perhaps eroded.
16	The approach is based on a theory of justice that considers crime and wrongdoing to be an offense against an individual or community, rather than the State. Restorative justice that foster dialogue between victim and offender has shown the highest rates of victim satisfaction and offender accountability.
17	Inherent in many people’s understanding of the notion of ADR is the existence of a dispute between identifiable parties. Criminal justice, however, is not usually conceptualised as a dispute between victim and offender, but is instead seen a a matter concerning the relationship between the offender and the state. This raise a complex question as to whether a criminal offence can properly be described a a ‘dispute’.
18	Criminal justice, however, is not usually conceptualised a a dispute between victim and offender, but is instead seen a a matter concerning the relationship between the offender and the state. 3 This raises a complex question as to whether a criminal offence can properly be described a a ‘dispute’.
19	The circle includes a wide range of participants including not only the offender and the victim but also friend and families, community members, and justice system representatives. The primary distinction between conferencing and circle is that circles do not focus exclusively on the offense and do not limit their solutions to repairing the harm between the victim and the offender.
20	Phloem is a conductive (or vascular) tissue found in plants. Phloem carry the product of photosynthesis (sucrose and glucose) from the leaf to other parts of the plant. … The corresponding system that circulates water and minerals from the roots is called the xylem.
21	Phloem and xylem are complex tissue that perform transportation of food and water in a plant. They are the vascular tissues of the plant and together form vascular bundles. They work together a a unit to bring about effective transportation of food, nutrients, mineral and water.
22	Phloem and xylem are complex tissue that perform transportation of food and water in a plant. They are the vascular tissues of the plant and together form vascular bundles.
23	Phloem is a conductive (or vascular) tissue found in plants. Phloem carries the product of photosynthesis (sucrose and glucose) from the leaves to other parts of the plant.
24	Unlike xylem (which is composed primarily of dead cells), the phloem is composed of still-living cell that transport sap. The sap is a water-based solution, but rich in sugar made by the photosynthetic areas.
25	In xylem vessel water travels by bulk flow rather than cell diffusion. In phloem, concentration of organic substance inside a phloem cell (e.g., leaf) creates a diffusion gradient by which water flows into cell and phloem sap move from source of organic substance to sugar sinks by turgor pressure.
26	The mechanism by which sugars are transported through the phloem, from sources to sinks, is called pressure flow. At the source (usually the leaves), sugar molecules are moved into the sieve element (phloem cells) through active transport.
27	Phloem carry the product of photosynthesis (sucrose and glucose) from the leaves to other parts of the plant. … The corresponding system that circulates water and minerals from the root is called the xylem.
28	Xylem transport water and soluble mineral nutrient from roots to various part of the plant. It is responsible for replacing water lost through transpiration and photosynthesis. Phloem translocates sugars made by photosynthetic area of plants to storage organ like roots, tuber or bulbs.
29	At this time the Industrial Workers of the World had a membership of over 100,000 members. In 1913 William Haywood replaced Vincent Saint John a secretary-treasurer of the Industrial Workers of the World. By this time, the IWW had 100,000 members.
30	This was not true of the Industrial Workers of the World and as a result many of it members were first and second generation immigrants. Several immigrant such as Mary 'Mother' Jones, Hubert Harrison, Carlo Tresca, Arturo Giovannitti and Joe Haaglund Hill became leaders of the organization.
31	Chinese Immigration and the Chinese Exclusion Acts. In the 1850s, Chinese worker migrated to the United States, first to work in the gold mines, but also to take agricultural jobs, and factory work, especially in the garment industry.
32	The Rise of Industrial America, 1877-1900. When in 1873 Mark Twain and Charles Dudley Warner entitled their co-authored novel The Gilded Age, they gave the late nineteenth century its popular name. The term reflected the combination of outward wealth and dazzle with inner corruption and poverty.
33	American objection to Chinese immigration took many forms, and generally stemmed from economic and cultural tensions, a well a ethnic discrimination. Most Chinese laborers who came to the United States did so in order to send money back to China to support their family there.
34	The rise of industrial America, the dominance of wage labor, and the growth of city represented perhaps the greatest change of the period. Few Americans at the end of the Civil War had anticipated the rapid rise of American industry.
35	The resulting Angell Treaty permitted the United States to restrict, but not completely prohibit, Chinese immigration. In 1882, Congress passed the Chinese Exclusion Act, which, per the terms of the Angell Treaty, suspended the immigration of Chinese laborer (skilled or unskilled) for a period of 10 years.
36	Industrial Workers of the World. In 1905 representatives of 43 group who opposed the policy of American Federation of Labour, formed the radical labour organisation, the Industrial Workers of the World (IWW). The IWW's goal wa to promote worker solidarity in the revolutionary struggle to overthrow the employing class.
37	The railroads powered the industrial economy. They consumed the majority of iron and steel produced in the United States before 1890. As late a 1882, steel rails accounted for 90 percent of the steel production in the United States. They were the nation’s largest consumer of lumber and a major consumer of coal.
38	This finally resulted in legislation that aimed to limit future immigration of Chinese workers to the United States, and threatened to sour diplomatic relation between the United States and China.
39	Costa Rica is known a a prime Eco-tourism destination so visitors are assured of majestic views, amazing destination spots and a temperate climate. These factors assure medical tourist of an excellent vacation experience that is conducive for recovery and relaxation.
40	Medical Tours Costa Rica: Medical Tourism Made Easy! “No Other Firm Has Helped More Patients. Receive Care Over the Last 15 Years”
41	Medical Tours Costa Rica difference: At MTCR, our aim is to become your “one-stop shop” for health care services, so we have put together packages with you, the medical tourist, in mind, offering a wide variety of specialties.
42	Cost of Medical Treatment in Costa Rica. The following are cost comparisons between Medical procedures in Costa Rica and equivalent procedure in the United States: [sources: 1,2]
43	Common Treatments done by Medical Tourists in Costa Rica. Known initially for its excellent dental surgery services, medical tourism in Costa Rica ha spread to a variety of other medical procedures, including: General and cosmetic dentistry; Cosmetic surgery; Aesthetic procedure (botox, skin resurfacing etc) Bariatric and Laparoscopic surgery
44	Medical Tours costa Rica office remains within the hospital and the Cook brother 15 year relationship running the hospital’s insurance office and seven year running the international patient department serves you the client very well.
45	About us. Medical Tours Costa Rica has helped thousand of patient and are the innovators in medical travel to Costa Rica. Brad and Bill Cook are visionaries that saw the writing on the wall while running the International insurance office for Costa Rica’s busiest and most respected hospital The Clinica Biblica.
46	In an era of rising health care cost and decreased medical coverage, the concept of combining surgery with travel has taken off. The last decade has seen a boom in the health tourism sector in Costa Rica, especially in the area of plastic surgery.
47	The World Bank ranked Costa Rica as having the highest life expectancy, at 78.7 years. This figure is the highest amongst all country in Latin America, and is equivalent to the level in Canada and higher than the United States by a year. Top Hospitals for Medical Tourism in Costa Rica
48	Over the last decade, Costa Rica has evolved from being a mere eco-tourism destination and emerged as a country of choice for foreigners, particularly from United States and Canada. These seek quality healthcare service and surgery at a much lower price than their home countries.
49	Color—urine can be a variety of colors, most often shades of yellow, from very pale or colorless to very dark or amber. Unusual or abnormal urine color can be the result of a disease process, several medications (e.g., multivitamin can turn urine bright yellow), or the result of eating certain foods.
50	I had 3 cup of coffee and a red bull today all in 4 hours. The first time I urinated, it wa an amber color. Then I got worried and drank a lot of water and now my urine is back to normal (light yellow). This only happened once after drinking all that caffeine. Related Topics: Coffee, Urination, Drinking, Caffeine.
51	During the visual examination of the urine, the laboratorian observes the urine's color and clarity. These can be sign of what substance may be present in the urine. They are interpreted in conjunction with result obtained during the chemical and microscopic examination to confirm what substance are present.
52	But the basic details of your urine -- color, smell, and how often you go -- can give you a hint about what’s going on inside your body. Pee is your body’s liquid waste, mainly made of water, salt, and chemicals called urea and uric acid. Your kidney make it when they filter toxin and other bad stuff from your blood.
53	However, red-colored urine can also occur when blood is present in the urine and can be an indicator of disease or damage to some part of the urinary system. Another example is yellow-brown or greenish-brown urine that may be a sign of bilirubin in the urine (see The Chemical Examination section).
54	The shade, light or dark, also changes. If it ha no color at all, that may be because you’ve been drinking a lot of water or taking a drug called a diuretic, which helps your body get rid of fluid. Very dark honey- or brown-colored urine could be a sign that you’re dehydrated and need to get more fluids right away.
55	A good rule of thumb is the darker your urine, the more water you need to drink. And if your urine is any other color besides a various shade of yellow (which we’ll get into down below) something may be wrong.
56	Color, density, and smell can reveal health problems. Human urine has been a useful tool of diagnosis since the earliest days of medicine. The color, density, and smell of urine can reveal much about the state of our health. Here, for starters, are some of the things you can tell from the hue of your liquid excreta. Advertising Policy.
57	More concentrated urine in the bladder can be darker. As long as your urine returned to a more-normal, light yellow color after you drank more water, there is no need to be concerned.
58	The color, density, and smell of urine can reveal much about the state of our health. Here, for starters, are some of the thing you can tell from the hue of your liquid excreta. Cleveland Clinic is a non-profit academic medical center. Advertising on our site helps support our mission.
59	The most common cause for liver transplantation in adults is cirrhosis caused by various type of liver injury such as infection (hepatitis B and C), alcohol, autoimmune liver diseases, early‐stage liver cancer, metabolic and hereditary disorders, but also disease of unknown aetiology.ombination therapy of ursodeoxycholic acid and corticosteroid for primary biliary cirrhosis with features of autoimmune hepatitis: a meta-analysis. A meta-analysis was performed of RCTs comparing therapy that combine UDCA and corticosteroid with UDCA monotherapy.
60	Inborn error of bile acid synthesis can produce life-threatening cholestatic liver disease (which usually presents in infancy) and progressive neurological disease presenting later in childhood or in adult life.he neurological presentation often includes signs of upper motor neurone damage (spastic paraparesis). The most useful screening test for many of these disorder is analysis of urinary cholanoids (bile acid and bile alcohols); this is usually now achieved by electrospray ionisation tandem mass spectrometry.
61	Autoimmune liver disease and thyroid disease. Autoimmune disorders, including autoimmune thyroid disorders, occur in up to 34% of patients with autoimmune hepatitis. The presence of these disorder is associated with female sex, older age and certain human leukocyte antigen (HLAs).he liver might also be affected in patient with the genetic autoimmune disease, polyglandular autoimmune syndrome, which affect the thyroid gland. This interaction again demonstrates crosstalk between autoimmune disturbance in the thyroid system and the liver.
62	Primary biliary cirrhosis, or PBC, is a chronic, or long-term, disease of the liver that slowly destroys the medium-sized bile duct within the liver. Bile is a digestive liquid that is made in the liver. It travel through the bile ducts to the small intestine, where it helps digest fats and fatty vitamins.In patients with PBC, the bile ducts are destroyed by inflammation. This cause bile to remain in the liver, where gradual injury damages liver cell and cause cirrhosis, or scarring of the liver.As cirrhosis progresses and the amount of scar tissue in the liver increases, the liver loses it ability to function.t travel through the bile ducts to the small intestine, where it help digest fats and fatty vitamins. In patients with PBC, the bile duct are destroyed by inflammation. This causes bile to remain in the liver, where gradual injury damage liver cells and causes cirrhosis, or scarring of the liver.
63	Hepatitis B and C, alcoholism, hemochromatosis, and primary biliary cirrhosis -- all causes of cirrhosis -- are some of the major risk factors for liver cancer. Cirrhosis due to hepatitis C is the leading cause of hepatocellular carcinoma in the United States.rimary Biliary Cirrhosis. Up to 95% of primary biliary cirrhosis (PBC) cases occur in women, usually around age 50. In people with PBC, the immune system attacks and destroys cells in the liver’s bile ducts. Like many autoimmune disorders, the causes of PBC are unknown.
64	The disorder of peroxisome biogenesis and peroxisomal β-oxidation that affect bile acid synthesis will be covered in the review by Ferdinandusse et al.he neurological presentation often includes signs of upper motor neurone damage (spastic paraparesis). The most useful screening test for many of these disorders is analysis of urinary cholanoids (bile acids and bile alcohols); this is usually now achieved by electrospray ionisation tandem mass spectrometry.
65	The neurological presentation often includes sign of upper motor neurone damage (spastic paraparesis). The most useful screening test for many of these disorder is analysis of urinary cholanoids (bile acid and bile alcohols); this is usually now achieved by electrospray ionisation tandem mass spectrometry.he neurological presentation often includes sign of upper motor neurone damage (spastic paraparesis). The most useful screening test for many of these disorder is analysis of urinary cholanoids (bile acids and bile alcohols); this is usually now achieved by electrospray ionisation tandem mass spectrometry.
66	Autoimmune Hepatitis. A liver disease in which the body's immune system damage liver cells for unknown reasons. PubMed Health Glossary. (Source: NIH-National Institute of Diabetes and Digestive and Kidney Diseases).ombination therapy of ursodeoxycholic acid and corticosteroids for primary biliary cirrhosis with feature of autoimmune hepatitis: a meta-analysis. A meta-analysis wa performed of RCTs comparing therapy that combine UDCA and corticosteroids with UDCA monotherapy.
67	1 itchiness (pruritus). 2  Pruritus is the primary symptom of cholestasis and is thought to be due to interactions of serum bile acids with opioidergic nerves. 3  In fact, the opioid antagonist naltrexone is used to treat pruritus due to cholestasis.ile is secreted by the liver to aid in the digestion of fats. Bile formation begins in bile canaliculus that form between two adjacent surface of liver cell (hepatocytes) similar to the terminal branches of a tree.
68	Primary Biliary Cirrhosis. Up to 95% of primary biliary cirrhosis (PBC) cases occur in women, usually around age 50. In people with PBC, the immune system attacks and destroys cells in the liver’s bile ducts. Like many autoimmune disorders, the cause of PBC are unknown.rimary Biliary Cirrhosis. Up to 95% of primary biliary cirrhosis (PBC) cases occur in women, usually around age 50. In people with PBC, the immune system attacks and destroys cell in the liver’s bile ducts. Like many autoimmune disorders, the cause of PBC are unknown.
69	However, a major motive with people today wanting to use the barley harvest to determine the start of the year is to justify starting the year AS EARLY AS POSSIBLE, frequently even before the end of winter. That is in fact the opposite of what the Talmud record the leader of the Sanhedrin occasionally doing ...
70	Some people claim that the timing of the barley harvest in Israel should be the deciding factor as to when to start the new year for determining the observance of God's annual Feasts and Holy Days.
71	Barley (Hordeum vulgare L.), a member of the grass family, is a major cereal grain. It wa one of the first cultivated grain and is now grown widely. Barley grain is a staple in Tibetan cuisine and wa eaten widely by peasants in Medieval Europe. Barley has also been used a animal fodder, a a source of fermentable material for beer and certain distilled beverages, and a a component of various health foods.
72	The state of the barley harvest could PERHAPS cause the start of a year to be postponed to THE FOLLOWING NEW MOON (thereby giving the previous year a 13th month), but the state of the barley harvest could NEVER DETERMINE THAT AN EARLIER NEW MOON SHOULD BE USED TO START THE YEAR!
73	The grape harvest wa usually completed before Tabernacles, but most of the olive harvest came after the autumn festivals. In ancient Israel the primary harvest season extended from April to November. This harvest period might be subdivided into three seasons and three major crops: the spring grain harvest, the summer grape harvest and the autumn olive harvest.
74	Barley is not as cold tolerant a the winter wheats (Triticum aestivum), fall rye (Secale cereale) or winter triticale (× Triticosecale Wittm. ex A. Camus.), but may be sown a a winter crop in warmer area of Australia and Great Britain. Barley ha a short growing season and is also relatively drought tolerant.
75	“Wheat ripens later than barley and, according to the Gezer Manual, was harvested during the sixth agricultural season, yrh qsr wkl (end of April to end of May)” (page 88; also see the chart on page 37 of Borowski’s book, reproduced below).
76	That claim is obviously not correct. God did not hinge the start of a new year on the state of the barley crop, even if on occasion in the first and second centuries A.D. the pharisaical leader of the Sanhedrin in Jerusalem decided to use the state of the barley harvest to start a new year one new moon later.
77	Barley is always sown in the autumn, after the early rains, and the barley harvest, which for any given locality precedes the wheat harvest (Exodus 9:31 f), begin near Jericho in April--or even March--but in the hill country of Palestine is not concluded until the end of May or beginning of June.
78	Pentecost, near the end of the grain harvest, included grain and loaf offering (verses 16-17). Pentecost wa also called “the Feast of Harvest” (Exodus 23:16). Barley and wheat were planted in the autumn and ripened in spring. Barley matured faster and would be harvested sooner. The firstfruits of grain offered during the Festival of Unleavened Bread would have been barley.
79	There are however some very serious illness that can cause this pain in left side under ribs. These would include pneumothorax, pancreatitis, and dissection of the abdominal aorta. It could also be a spleen disorder, kidney stones, or pericardritis (inflammation of the heart sac).
80	Pancreatitis is an inflammation of the pancreas and can be caused by eating very fatty foods. If the left side pain under ribs is caused by a dissection of the abdominal aorta, your life is in immediate danger. Dying from an internal hemorrhage is the major risk involved in this situation.
