81	What organ are on your left side of body. Causes of Pain under Left Rib Cage. Here are just some of the possible reasons why you may be feeling pain under your left rib cage: Gas Stuck in the Colon – There is a chance that you have gas stuck in your colon. The amount of gas that is stuck may be excessive.
82	For the individual bones, see Rib. For ribs of animals a food, see Ribs (food). For other uses, see Rib (disambiguation). The rib cage is an arrangement of bone in the thorax of all vertebrate except the lamprey and the frog. It is formed by the vertebral column, ribs, and sternum and encloses the heart and lungs.
83	If the lower set of ribs on the right side of the rib cage get damaged due to an injury, then one is likely to experience a sharp pain under the right rib cage. If the pain worsens when one tries to bend or twist the body, then an X-ray examination should be conducted to study the extent of damage to the ribs.
84	Vital organs such as heart and lung are protected by the rib cage. Under the rib cage lie many organs that form a part of the abdomen. Most of the organ that lie in the abdominal region are a part of the digestive system. These include the liver, gallbladder, kidneys, pancreas, spleen, stomach, small intestine and the large intestine.
85	The only organ contained in the chest cavity are the lung and the heart. Obviously, one of the lungs is under the left rib cage, and then the heart is also found here. The o…nly other part of the chest cavity to be noted would be the diaphragm, which aids a person's breathing. 4 people found this useful.
86	Usually, you can feel the pain reverberating from the upper portion of the left side of your abdomen towards the left side of your ribcage. Irritation on the Spleen – There is a chance that your spleen ha already ruptured because of various reason and this can cause some pains on the left rib cage.
87	Each rib consists of a head, neck, and a shaft, and they are numbered from top to bottom. The head of rib is the end part closest to the spine with which it articulates. It is marked by a kidney-shaped articular surface which is divided by a horizontal crest into two facets.
88	With either of these there is a fairly simple medication treatment. There is also the possibility that gas is caught in the colon. This is even le serious that acid reflux and does not require medication to resolve it. Sharp pain left side under ribs might come from a condition called costochondritis.
89	1 COMMERCIAL CONCRETE. Since 1981, Wheeler Services, Inc has handled commercial concrete project such as Medical offices, Auto plants, Commercial buildings, Retail buildings, Colleges, Manufacturing Plants, Restaurants, Churches, Our area of service include Georgia, Alabama, North Carolina and South Carolina.
90	Lendmark Financial Services, LLC Steve was named Chief Credit Officer of Lendmark Financial Services, LLC in January 2016. In his current role, Steve oversees the credit philosophy and manages both the short and long-term credit strategy for Lendmark.
91	Wheeler Services, Inc. is a commercial contractor specialized in building concrete structures such as foundations, slab on grade,elevated decks, retaining walls, heavy duty paving, hardscaping,staircases, and storm water management structures. Additionally, its commercial and residential landscaping division has been in business since 1981.
92	Dr. Wheeler graduated from the Latvian Med Academy, Riga, Latvia (fn: 594 01) in 1977. She work in Crisfield, MD and 1 other location and specializes in Emergency Medicine. Dr. Wheeler is affiliated with Atlantic General Hospital, McCready Foundation and Peninsula Regional Medical Center. Experience Years Experience: 41
93	With over 20 year of experience in the financial services industry, Steve ha extensive expertise in consumer finance risk management and compliance, operational risk management, and securitization and funding strategy.
94	Steve Wheeler was recently named Chief Credit Officer for Lendmark Financial Services, LLC. Click to learn more about Steve Wheeler.
95	Dr. Wheeler's Education & Training. Medical School Latvian Med Academy, Riga, Latvia (fn: 594 01); Graduated 1977
96	He hold a Bachelor of Arts degree in American Legal and Constitutional History from the University of Minnesota where he was a member of Phi Beta Kappa. Steve is also a proud veteran who served in the U.S. Army and U.S. Army Reserves. ©2017 Lendmark Financial Services, LLC. Steve wa named Chief Credit Officer of Lendmark Financial Services, LLC in January 2016. In his current role, Steve oversees the credit philosophy and manages both the short and long-term credit strategy for Lendmark.
97	Dr. Wheeler's Accepted Insurance. Please verify insurance information directly with your doctor's office a it may change frequently. Not Available; Dr. Wheeler's Office Information & Appointments
98	Wheeler Services is licensed in the Georgia, Alabama, North Carolina, South Carolina, and Tennessee. Wheeler Services, Inc. is a commercial contractor specialized in building concrete structure such as foundations, slabs on grade, elevated decks, retaining walls, heavy duty paving, hardscaping, staircases, and storm water management structures.
99	(1841 - 1904) Contrary to legend, Antonín Dvořák (September 8, 1841 - May 1, 1904) was not born in poverty. His father was an innkeeper and butcher, a well as an amateur musician. The father not only put no obstacles in the way of his son's pursuit of a musical career, he and his wife positively encouraged the boy.
