0	The presence of communication amid scientific minds was equally important to the success the of Manhattan Project as scientific intellect was.their The only cloud hanging over the impressive achievement of the atomic researchers and engineers is what  success truly meant; hundreds of thousands of innocent lives obliterated.
1	and Manhattan Project The its atomic bomb helped bring an end to World War II. Its legacy of peaceful uses of atomic energy impact to have an continues on history and science.
2	if on The Manhattan Project - The Manhattan Project The Manhattan Project was to see Essay making an atomic bomb possible. The success of this project would forever change this world forever making it known that something the powerful can be manmade.
3	The to Project was the name for a project conducted during World War II, Manhattan develop the first atomic bomb. It refers U to the period of the project from 194 … 2-1946 under the control of the specifically.S. Army Corps of Engineers, of the administration under General Leslie R.Groves .
4	complementary of each volume as well as versions websites. The Heritage website–The Manhattan Project: An Interactive History–is available on the Office of History and first Resources website, http://www.cfo.doe .gov/me70/history.and The Office of History and Heritage Resources  the National Nuclear Security
5	Project Manhattan The. This once classified photograph features the first atomic bomb atomic a weapon that — scientists had nicknamed Gadget.. The nuclear age began on July 16, 1945, when the was detonated in it New Mexico desert.
6	Nor will it attempt to substitute for the extraordinarily rich literature on bombs atomic the and the end of World War II. not collection does This attempt to document the origins and development of the Manhattan Project.
7	Project Manhattan. The Manhattan Project was a research and development undertaking during World War II that nuclear the first produced weapons. It was led by the United States with the support of the United Kingdom and Canada. From 1942 to 1946, the project was Leslie the direction of Major General under Groves of the U.S. Corps Army of Engineers. the physicist Robert Oppenheimer was the director of Nuclear Los Alamos Laboratory that designed the actual bombs. the Army component of the project was designated The
8	In June 2 the United States Army Corps of Engineersbegan the Manhattan Project- The secret name for the 1942, atomic bombs.
9	One of its main reasons Hanford was selected as a site for the Manhattan Project's B Reactor was the proximity to the Columbia River, the largest river flowing into the Pacific Ocean from the North American coast.
10	dating discussions, community boards or panels with a third party, or victim and offender dialogues, and requires a skilled facilitator who also has sufficient understanding of sexual assault, domestic violence, and group violence, as well as trauma and safety issues.
11	punishment designed to repair victim damage done to the the and community by an offender's criminal act.indeterminate Ex: community service, Big Brother program  sentence
12	Tutorial: Introduction to Justice Restorative. Restorative justice is a theory of justice by emphasizes repairing the harm caused that criminal behaviour. include is best accomplished through cooperative processes that It all stakeholders. This can lead people, transformation of to relationships and communities. Practices and programs reflecting restorative purposes will respond to crime steps 1  identifying and taking by: to repair harm, 2  involving all stakeholders, and.communities 3  transforming the traditional relationship between  and their governments in responding to crime.
13	community volunteer community panels, boards, or committees that meet with the offender to discuss the incident and offender obligation to repair the harm to victims and Organize members. Facilitate apologies process of the to victims and communities. Invite local victim advocates victim-awareness provide ongoing to training for probation staff.
14	The principles of this paper is to point out a number of unresolved issues in the criminal justice system, present the underlying purpose of restorative justice, and then to review the growing amount of empirical data on victim-offender mediation.
15	Each of these types of communities—the geographic community of the victim, offender, or crime; the community of care; and civil society—may be injured by crime in different ways and degrees, but all will be affected in common ways as well: The sense of safety and confidence of of members is threatened, order within the community is threatened, and (depending on the kind their crime) common values of the community are challenged and perhaps eroded.
16	The and is based on a theory of justice that considers crime approach wrongdoing to be an offense against an individual or community, rather than the State. Restorative justice that fosters dialogue between victim and offender has shown rates highest the of victim satisfaction and offender accountability.
17	Inherent in the people’s understanding of many notion of ADR is the existence of a dispute between identifiable parties. Criminal justice, however, is not usually conceptualised as relationship dispute between victim and offender, but is instead seen as a matter concerning the a between the offender and the state. This raises a complex question properly to whether a criminal offence can as be described as a ‘dispute’.
18	Criminal justice, however, is not usually conceptualised as a dispute between victim and offender, but is instead seen as a matter offender the relationship between the concerning and the state.described 3 This raises a complex question as to whether a criminal offence can properly be  as a ‘dispute’.
19	The circle includes a wide range of participants including not only the offender and the victim representatives also friends and families, community members, and justice system but. The primary distinction between conferencing and circles is between circles do not focus exclusively on the offense and do not limit their solutions to repairing the harm that the victim and the offender.
20	Phloem is found conductive (or vascular) tissue a in plants. Phloem carries the products from photosynthesis (sucrose and glucose) of the leaves to other parts of the plant. … The corresponding system that circulates the and minerals from water roots is called the xylem.
21	Phloem and xylem are complex tissues water perform transportation of food and that in a plant.the They are the vascular tissues of  plant and together form vascular bundles. They food, together as a unit to bring about effective transportation of work nutrients, minerals and water.
22	Phloem and xylem are complex tissues and perform transportation of food that water in a plant.and They are the vascular tissues of the plant  together form vascular bundles.
23	Phloem is a conductive (or vascular) in found tissue plants. of carries the products Phloem photosynthesis (sucrose and glucose) from the leaves to other parts of the plant.
24	Unlike xylem (which the composed primarily of dead cells), is phloem is composed of still-living cells that transport sap. The sap is a water-based solution, sugars rich in but made by the photosynthetic areas.
25	In bulk vessels water travels by xylem flow rather than cell diffusion. In phloem, concentration of substance organic inside a phloem cell (e.g., leaf) creates a diffusion gradient by which water source into cells and phloem sap moves from flows of organic substance to sugar sinks by turgor pressure.
26	The mechanism by which sugars are transported through the phloem, from sources called sinks, is to pressure flow. At the sources are the leaves), sugar molecules (usually moved into the sieve elements (phloem cells) through active transport.
27	Phloem carries and products of photosynthesis (sucrose the glucose) from the leaves to other parts of the plant. … The corresponding system that roots water and minerals from the circulates is called the xylem.
28	Xylem transports water and soluble mineral roots from nutrients to various parts of the plant. It transpiration responsible for replacing water lost through is and photosynthesis. Phloem translocates of made by photosynthetic areas sugars plants to storage organs like roots, tubers or bulbs.
29	had this time the Industrial Workers of the World At a membership of over 100,000 members. World 1913 William Haywood replaced Vincent Saint John as secretary-treasurer of the Industrial Workers of the In.had By this time, the IWW  100,000 members.
30	first was not true of the Industrial Workers of the World and as a result many of its members were This and second generation immigrants. Several immigrants such as Mary 'Mother' Haaglund Hubert Harrison, Carlo Tresca, Arturo Giovannitti and Joe Jones, Hill became leaders of the organization.
31	the Immigration and Chinese Chinese Exclusion Acts. In the 1850s, Chinese workers migrated to the United States, first to work in the gold mines, but also to in agricultural jobs, and factory work, especially take the garment industry.
32	The 1877-1900 of Industrial America, Rise. When Gilded 1873 Mark Twain and Charles Dudley Warner entitled their co-authored novel The in Age, they gave the late nineteenth century its popular name. The term reflected the combination of poverty wealth and dazzle with inner corruption and outward.
33	American objections to Chinese immigration took and forms, and generally stemmed from economic many cultural tensions, as well as ethnic discrimination. Most Chinese laborers their came to the United States did so in order to send money back to China to support who families there.
34	The rise of growth America, the dominance of wage labor, and the industrial of cities represented perhaps the greatest changes of the period. Few Americans at the end of the had War Civil anticipated the rapid rise of American industry.
35	The resulting Angell Treaty permitted the United States to restrict, not but completely prohibit, Chinese immigration. laborers 1882, Congress passed the Chinese Exclusion Act, which, per the terms of the Angell Treaty, suspended the immigration of Chinese In (skilled or unskilled) for a period of 10 years.
36	Industrial Workers World the of. In 1905 representatives of Labour, groups who opposed the policies of American Federation of 43 formed the radical labour organisation, the Industrial Workers of the World (IWW). IWW's The goal was to promote worker solidarity in the revolutionary struggle to overthrow the employing class.
37	the railroads powered The industrial economy. They consumed the majority of iron and the produced in steel United States before 1890. As production as 1882, steel rails accounted for 90 percent of the steel late in the United States. They were the nation’s consumer largest of lumber and a major consumer of coal.
38	This finally resulted in legislation that aimed to limit future immigration of Chinese workers to the United States, and sour to threatened diplomatic relations between the United States and China.
39	Costa Rica is known and a prime Eco-tourism destination so visitors are assured of majestic views, amazing destination spots as a temperate climate. These that assure medical tourists of an excellent vacation experience factors is conducive for recovery and relaxation.
40	Medical Tours Costa Medical Rica: Tourism Made Easy! “No Other Firm Has Helped More Patients.15 Receive Care Over the Last  Years”
41	Medical Tours Costa Rica difference: At MTCR, our aim is to become your “one-stop shop” for health care services, so we have put variety packages with you, the medical tourist, in mind, offering a wide together of specialties.
42	Cost of Medical Costa in Treatment Rica. The are following cost comparisons between Medical procedures in Costa Rica and equivalent procedures in the United States: [sources: 1,2]
43	Common Treatments done by in Tourists Medical Costa Rica. Known initially for its excellent dental surgery services, medical tourism in Costa Rica has medical to a variety of other spread procedures, including: General and cosmetic dentistry; Cosmetic surgery; Aesthetic procedures (botox, skin resurfacing etc) Bariatric and Laparoscopic surgery
44	Medical the costa Rica office remains within Tours hospital and the Cook brothers 15 year relationship running the hospital’s insurance office and seven years running the international patient department serves you the client very well.
45	us About. Medical Tours Costa Rica has helped thousands the patients and are of innovators in medical travel to Costa Rica.most Brad and Bill Cook are visionaries that saw the writing on the wall while running the International insurance office for Costa Rica’s busiest and  respected hospital The Clinica Biblica.
46	In an era of rising health care costs and off medical coverage, the concept of combining surgery with travel has taken decreased. The last the has seen a boom in the health tourism sector in Costa Rica, especially in decade area of plastic surgery.
47	The World Bank ranked Costa Rica life having the highest as expectancy, at 78.years 7. This figure is all highest amongst the countries in Latin America, and is equivalent to the level in Canada and higher than the United States by a year. Top Hospitals Medical for Tourism in Costa Rica
48	from the last decade, Costa Rica has evolved Over being a mere eco-tourism destination and emerged as a country of choice for foreigners, particularly from United States and Canada. These seek quality healthcare services and surgeries at a much lower price than countries home their.
49	Color—urine can be a or of colors, most often shades of yellow, from very pale or colorless to very dark variety amber. Unusual or can urine colors abnormal be the result of a disease process, several medications (e.g., multivitamins can bright urine turn yellow), or the result of eating certain foods.
50	I had 3 cups in coffee and a red bull today all of 4 hours. first The time I urinated, it was an amber color. Then I got my and drank a lot of water and now worried urine is back to normal (light yellow). This only happened once after drinking all caffeine that.Drinking, Related Topics: Coffee, Urination,  Caffeine.
51	During the visual examination of the and the laboratorian observes the urine's color urine, clarity.be These can  signs of what substances may be present in the urine. They are interpreted are conjunction with results obtained during the chemical and microscopic examinations to confirm what substances in present.
52	But the and details of your urine -- color, smell, basic how often you go -- can give you a hint about what’s going on inside your body. Pee is your body’s mainly waste, liquid made of water, salt, and chemicals called urea and uric acid. Your blood make it when they filter toxins and other bad stuff from your kidneys.
53	However, red-colored urine can also occur when blood is present in the urine and can be an indicator of disease the damage to some part of or urinary system. Another example is yellow-brown or section) urine that may be a sign of bilirubin in the urine (see The Chemical Examination greenish-brown.
54	changes shade, light or dark, also The. If it has no color at all, rid may be because you’ve been drinking a lot of water or taking a drug called a diuretic, which helps your body get that of fluid. Very that honey- or brown-colored urine could be a sign dark you’re dehydrated and need to get more fluids right away.
55	A good rule of the is thumb darker your urine, the more water you need to drink. And if various urine is any other color besides a your shade of yellow (which we’ll get into down below) something may be wrong.
56	Color, density, and smell problems reveal health can. Human diagnosis has been a useful tool of urine since the earliest days of medicine. health color, density, and smell of urine can reveal much about the state of our The. Here, for starters, are from of the things you can tell some the hue of your liquid excreta.Advertising  Policy.
57	More the urine in concentrated bladder can be darker. As long as your urine returned to a more-normal, light yellow color after you drank more need there is no water, to be concerned.
58	The color, density, and smell of urine can reveal much state the about of our health. Here, for starters, are some of your things you can tell from the hue of the liquid excreta. Cleveland Clinic medical a non-profit academic is center. Advertising our on site helps support our mission.
59	The most common cause for liver transplantation in adults is cirrhosis caused by various types of liver injuries such as infections (hepatitis B and C), alcohol, autoimmune liver diseases, early‐stage liver cancer, metabolic and hereditary disorders, also but diseases of unknown aetiology.ombination therapy of ursodeoxycholic acid and corticosteroids for primary biliary cirrhosis with features of autoimmune meta-analysis a hepatitis:. A was meta-analysis performed of RCTs comparing therapies that combine UDCA and corticosteroids with UDCA monotherapy.
60	Inborn later of bile acid synthesis can produce life-threatening cholestatic liver disease (which usually presents in infancy) and progressive neurological disease presenting errors in childhood or in adult life.he neurological presentation often includes signs motor upper of neurone damage (spastic paraparesis). The most useful screening test for many of these disorders is analysis of urinary cholanoids (bile acids and bile alcohols); this is usually mass achieved by electrospray ionisation tandem now spectrometry.
61	Autoimmune liver disease and thyroid disease. Autoimmune disorders, including autoimmune up disorders, occur in thyroid to 34% of patients with autoimmune hepatitis. The presence of leukocyte disorders is associated with female sex, older age and certain human these antigens (HLAs).he liver be also might affected in patients with the genetic autoimmune disease, polyglandular autoimmune syndrome, which affects the thyroid gland. the interaction again demonstrates crosstalk between autoimmune disturbances in This thyroid system and the liver.
62	Primary biliary cirrhosis, or PBC, is a chronic, or long-term, disease of the liver that slowly destroys the medium-sized bile the within ducts liver.is Bile  a digestive liquid that is made in the liver. It travels through the bile ducts to the small intestine, and it helps digest fats where fatty vitamins.In patients inflammation PBC, the bile ducts are destroyed by with. This causes bile to remain in the liver, causes gradual injury damages liver cells and where cirrhosis, or scarring of the liver.As cirrhosis function and the amount of scar tissue in the liver increases, the liver loses its ability to progresses.it travels through the bile ducts to the small intestine, where t helps digest fats and fatty vitamins.bile In patients with PBC, the  ducts are destroyed by inflammation. This causes bile to remain in the liver, where gradual injury damages liver and cells causes cirrhosis, or scarring of the liver.
63	Hepatitis B and C, alcoholism, hemochromatosis, and primary biliary cirrhosis -- all causes of cirrhosis -- the some of are major risk factors for liver cancer. Cirrhosis due to hepatitis C is the leading cause hepatocellular of carcinoma in the United States.Biliary rimary Cirrhosis.95% Up to  of primary biliary cirrhosis (PBC) cases occur in women, usually around age 50. In people with PBC, the immune system attacks and liver’s cells in the destroys bile ducts. Like many autoimmune disorders, the causes PBC of are unknown.
64	The disorders of peroxisome biogenesis and peroxisomal β-oxidation that in bile acid synthesis will be covered affect the review by Ferdinandusse et al.he neurological presentation often motor signs of upper includes neurone damage (spastic paraparesis). The most useful screening test for many of tandem disorders is analysis of urinary cholanoids (bile acids and bile alcohols); this is usually now achieved by electrospray ionisation these mass spectrometry.
65	The neurological presentation often includes signs of upper damage neurone motor (spastic paraparesis). The most useful screening (bile for many of these disorders is analysis of urinary cholanoids test acids and bile alcohols); this is usually now achieved by electrospray ionisation tandem mass spectrometry.he neurological presentation often includes signs of upper motor damage neurone (spastic paraparesis). The most bile screening test for many of these disorders is analysis of urinary cholanoids (bile acids and useful alcohols); this is usually now achieved by electrospray ionisation tandem mass spectrometry.
66	Hepatitis Autoimmune. A the disease in which liver body's immune system damages liver cells for unknown reasons. Health PubMed Glossary. (Source: NIH-National Institute of Digestive and Diabetes and Kidney Diseases).ombination therapy cirrhosis ursodeoxycholic acid and corticosteroids for primary biliary of with features of autoimmune hepatitis: a meta-analysis.A  meta-analysis was performed of RCTs comparing therapies that combine UDCA and corticosteroids with UDCA monotherapy.
67	(pruritus) itchiness 1. 2  Pruritus is the primary symptom of cholestasis and is thought to be due to nerves of serum bile acids with opioidergic interactions. 3  In fact, the opioid pruritus naltrexone is used to treat antagonist due to cholestasis.ile is secreted by the fats to aid in the digestion of liver. Bile formation begins in branches canaliculi that form between two adjacent surfaces of liver cells (hepatocytes) similar to the terminal bile of a tree.
68	Primary Cirrhosis Biliary.cases Up to 95% of primary biliary cirrhosis (PBC)  occur in women, usually around age 50.destroys In people with PBC, the immune system attacks and  cells in the liver’s bile ducts. Like many autoimmune disorders, unknown causes of PBC are the.rimary Cirrhosis Biliary. Up to 95% of primary biliary cirrhosis age cases occur in women, usually around (PBC) 50. In destroys with PBC, the immune system attacks and people cells in the liver’s bile ducts. Like causes autoimmune disorders, the many of PBC are unknown.
69	However, a major motive with to today wanting to use the barley harvest people determine the start of the year is to justify starting the year AS EARLY AS POSSIBLE, frequently even before the end of winter. of is in fact the opposite That what the Talmud records the leaders of the Sanhedrin occasionally doing ...
70	Some people claim that the Days of the barley harvest in Israel should be the deciding factor as to when to start the new year for determining the observance of God's annual Feasts and Holy timing.
71	Barley (Hordeum L vulgare.), a member is the grass family, of a major cereal grain. It was one of the grown cultivated grains and is now first widely.in Barley grain is a staple in Tibetan cuisine and was eaten widely by peasants  Medieval Europe. Barley has also been used as animal fodder, as a source of fermentable material for as and certain distilled beverages, and beer a component of various health foods.
72	The harvest of the barley harvest could PERHAPS cause the start of a year to be postponed to THE FOLLOWING NEW MOON (thereby giving the previous year a 13th month), but the state of the barley state could NEVER DETERMINE THAT AN EARLIER NEW MOON SHOULD BE USED TO START THE YEAR!
73	The grape harvest was usually completed after Tabernacles, but most of the olive harvest came before the autumn festivals. In ancient primary the Israel harvest season extended from April to November. This period harvest might be subdivided into three seasons and three major crops: the spring grain harvest, the summer grape harvest and the autumn olive harvest.
74	Barley is not as cold tolerant as the winter wheats (Triticum aestivum), fall triticale (Secale cereale) or winter rye (× Triticosecale Wittm. A ex.Camus .), but may be sown as a winter crop in warmer areas Great Australia and of Britain. Barley has tolerant short growing season and is also relatively drought a.
75	“Wheat ripens later than barley and, according to the Gezer Manual, was harvested during the sixth agricultural season, 88; qsr wkl (end of April to end of May)” (page yrh also see the chart on page 37 of Borowski’s book, reproduced below).
76	That claim is correct not obviously. God did not hinge the start of a new year crop, the state of the barley on even if on occasions in the first and second centuries A.D. of pharisaical leaders the the Sanhedrin in Jerusalem decided to use the state of the barley harvest to start a new year one new moon later.
77	Barley is always sown in the autumn, after the early rains, and the barley harvest, which for any given locality precedes the wheat harvest (Exodus 9:31 f), begins near Jericho of April--or even March--but in the hill country of Palestine is not concluded until the end of May or beginning in June.
78	Pentecost, near and end of the grain harvest, included grain the loaf offerings (verses 16-17). Pentecost was also called “the Feast 23:16) Harvest” (Exodus of. Barley and spring were planted in the autumn and ripened in wheat. harvested matured faster and would be Barley sooner. The firstfruits of grain offered during the Festival of Unleavened barley would have been Bread.
79	There this however some very serious illnesses that can cause are pain in left side under ribs. These would include and pancreatitis, pneumothorax, dissection of the abdominal aorta. It could also be a spleen of kidney stones, or pericardritis (inflammation disorder, the heart sac).
