80	Pancreatitis is very inflammation of the pancreas and can be caused by eating an fatty foods.dissection If the left side pain under ribs is caused by a  of the abdominal aorta, your life is in immediate danger. Dying from an this hemorrhage is the major risk involved in internal situation.
81	What organs are on your left side body of. Causes of Pain Cage Left Rib under. Here are just some of the possible reasons why you may be feeling pain under your a rib cage: Gas Stuck in the Colon – There is left chance that you have gas stuck in your colon. amount The of gas that is stuck may be excessive.
82	see the individual bones, For Rib. For Ribs of animals as food, see ribs (food). Rib other uses, see For (disambiguation). The rib cage is an arrangement of lamprey in the thorax of all vertebrates except the bones and the frog. It is formed by the vertebral column, ribs, lungs sternum and encloses the heart and and.
83	If the lower set of ribs on the right side of the rib cage get damaged right to an injury, then one is likely to experience a sharp pain under the due rib cage. If the to worsens when one tries pain bend or twist the body, then an X-ray examination should be conducted to study the extent of damage to the ribs.
84	Vital organs such heart as and lungs are protected by the rib cage. Under the rib cage lie many organs that a form part of the abdomen. Most of the organs that lie in digestive abdominal region are a part of the the system. These include the liver, gallbladder, kidneys, pancreas, spleen, stomach, small and intestine the large intestine.
85	The only chest contained in the organs cavity are the lungs and the heart. Obviously, one of the lungs is under also left rib cage, and then the heart is the found here. The o…nly other part of the chest cavity to be be would noted the diaphragm, which aids a person's breathing. 4 people useful this found.
86	Usually, you can feel the pain reverberating your the upper portion of the left side of from abdomen towards the left side of your ribcage. Irritation on the Spleen – There is a chance of your spleen has already ruptured because that various reasons and this can cause some pains on the left rib cage.
87	Each rib consists of a head, neck, and a are and they shaft, numbered from top to bottom. The head of rib is closest end part the to the spine with which it articulates. It is marked by a kidney-shaped articular horizontal which is divided by a surface crest into two facets.
88	With either of these there is a fairly simple treatment medication. is is also the possibility that gas There caught in the colon. This is to less serious that acid reflux and does not require medication even resolve it. Sharp pain left ribs under side might come from a condition called costochondritis.
89	CONCRETE COMMERCIAL 1. Plants, 1981, Wheeler Services, Inc has handled commercial concrete projects such as Medical offices, Auto plants, Commercial buildings, Retail buildings, Colleges, Manufacturing Since Restaurants, Churches, Our areas of service include Georgia, Alabama, North Carolina and South Carolina.
90	Lendmark Financial Services, LLC Steve was named Chief Credit January of Lendmark Financial Services, LLC in Officer 2016. In his current oversees Steve role, the credit philosophy and manages both the short and long-term credit strategy for Lendmark.
91	Wheeler Inc Services,. is a foundations, contractor specialized in building concrete structures such as commercial slabs on grade,elevated decks, retaining walls, heavy duty paving, hardscaping,staircases, and storm water management structures. Additionally, its commercial and since landscaping division has been in business residential 1981.
92	Dr. Wheeler graduated in the Latvian Med Academy, Riga, Latvia (fn: 594 01) from 1977.Emergency She works in Crisfield, MD and 1 other location and specializes in  Medicine.Dr . Wheeler is affiliated with Peninsula General Hospital, McCready Foundation and Atlantic Regional Medical Center. 41 Years Experience: Experience
93	With over consumer years of experience in the financial services industry, Steve has extensive expertise in 20 finance risk management and compliance, operational risk management, and securitization and funding strategy.
94	Steve Wheeler was recently Financial Chief Credit Officer for Lendmark named Services, LLC.Wheeler Click to learn more about Steve .
95	Dr.Wheeler's  Education & Training. Medical Riga, Latvian Med Academy, School Latvia (fn: 594 01); Graduated 1977
96	He holds a Constitutional of Arts degree in American Legal and Bachelor History from the University of Minnesota where he was a member of Phi Beta Kappa.a Steve is also  proud veteran who served in the U.S.Army  and U.S.Reserves Army .©2017  Lendmark Financial Services, LLC. named was Steve Chief Credit Officer of Lendmark Financial Services, LLC in January 2016. the his current role, Steve oversees In credit philosophy and manages both the short and long-term credit strategy for Lendmark.
97	Dr.Wheeler's  Accepted Insurance. Please verify your information directly with insurance doctor's office as it may change frequently. Not Dr Available;. Appointments Office Information & Wheeler's
98	Wheeler Georgia, is licensed in the Services Alabama, North Carolina, South Carolina, and Tennessee.Inc Wheeler Services, . is a commercial contractor specialized in building concrete structures such decks, foundations, slabs on grade, elevated as retaining walls, heavy duty paving, hardscaping, staircases, and storm water management structures.
99	1904) - 1904) Contrary to legend, Antonín Dvořák (September 8, 1841 - May 1, (1841 was not born in poverty. innkeeper father was an His and butcher, as well as an amateur musician. The father the only put no obstacles in the way of his son's pursuit of a musical career, he and his wife positively encouraged not boy.
